{
  "actions": [
    "records.sort"
  ],
  "aliases": [
    "records sort"
  ],
  "discovery_version": "0.1",
  "documents": [
    {
      "extensions": {},
      "id": "document.stdlib.records.sort",
      "language": "und",
      "source_digest": "sha256:2cd42174d80769ce4b2ff96a11ab9af30fe2505bf50630d7b6612844679a5958",
      "targets": [
        "node",
        "inputs",
        "outputs"
      ],
      "text": "Sort records deterministically by configured fields. Inputs: records. Outputs: records."
    }
  ],
  "domains": [
    "data.engineering"
  ],
  "extensions": {
    "stdlib.maturity": "reference"
  },
  "node_id": "stdlib.records.sort",
  "node_spec_digest": "sha256:2cd42174d80769ce4b2ff96a11ab9af30fe2505bf50630d7b6612844679a5958",
  "node_version": "1.0.0",
  "ports": [
    {
      "concepts": [],
      "description": "Typed records input.",
      "direction": "input",
      "examples": [],
      "port_name": "records"
    },
    {
      "concepts": [],
      "description": "Typed records output.",
      "direction": "output",
      "examples": [],
      "port_name": "records"
    }
  ],
  "purposes": [
    "Sort records deterministically by configured fields."
  ],
  "solutions": [
    "Compose this primitive into typed data preparation graphs."
  ],
  "summary": "Sort records deterministically by configured fields.",
  "tags": [
    "stdlib.reusable",
    "runtime.python"
  ],
  "title": "Sort"
}
